Index,Keyword,Tweets
0,nervious,Woooow 6 songs one day We nervious song disponible 15.00pm Before w
1,nervious,She looks like nervious breakdown
2,nervious,If sorry `` '' chat made nervious
3,nervious,If choices I leaning toward nervious breakdown
4,nervious,Studered words nervious dems gon na loose one way around
5,nervious,Right right uh clearly nervious/ uh .m movie
6,nervious,Full nervious gas
7,nervious,'s saying us
8,nervious,Are nervious Face Trump sucks
9,nervious,Ok Don history books
10,nervious,I tips look since case got bigger tried helping sister via FB When nervious
11,nervious,I tips look since case got bigger tried helping sister via FB When nervi
12,nervious,Ok Don histo
13,nervious,Tomorrow thesis defense day I nervious I best
14,nervious,Settle Nervious Nancy ... theybdid thing Do us favor stick
15,nervious,Carina answered every question like pro tho nervious beginning
16,nervious,Carina answered every question like pro tho nervious beginning
17,nervious,wo n't ever get good game shaky hands 'm nervious
18,nervious,I nervious '' indirections '' amp possible meanings.I read properly always wrong always te
19,nervious,I WAS SO NERVIOUS But know worked I glad know Natasha
20,nervious,Today I took first interview job English The positions job easy
21,nervious,Haha *nervious confusion*
22,nervious,Oscar Illuminati parody MEME ToughPigs MEME contest I 'm fortunate meet Caroll get book sign
23,nervious,Back 2014 Mind Crush Maxx C. Nervious hell discarded something I really needed GY plus got see opp 's hand
24,nervious,Good morning everyone I woke early I slept much I anxious nervious thi
25,nervious,The nervious parents vibe rest boys Jungkook much cool I wish I could
26,nervious,Schiff nervious Nancy tell us republican law ... .. however democrat
27,nervious,permission reveal prosthetic arm made using proportions gloves di
28,nervious,The nervious parents vibe rest boys Jungkook much cool I wish I could
29,nervious,Yuh boy nervious af 's gon na next days smh
30,nervious,The nervious parents vibe rest boys Jungkook much cool I wish I could
31,nervious,yolo ... nervious Wednesday
32,nervious,Miya saw vivi got nervious hear Your Love instrumental video
33,nervious,`` Lars always nervious onstage 'd play faster faster nobody wanted wimp tell him. `` -James Hetfield
34,nervious,You know bus ear buds eating something chewing gum sudden bec
35,nervious,I love versions The Photocard San OMG 'm nervious I never win things
36,nervious,Imagine scared walking around house lot drinking ton water cuz getting ner
37,nervious,Okay I 'm nervious tomorrow
38,nervious,im nervious
39,nervious,Seems one best experiences life yep I 'll try I 'm nervious think
40,nervious,I 'm nervious For everything Tanta intriga esta mat ndome ... que comience ...
41,nervious,Nervious
42,nervious,bout start barking im nervious ateez tickets also good luck everyone
43,nervious,The United Shtashes Donnie 's adderall something Donnie gets nervious REA
44,nervious,Everyting confiar nos feel much nervious
45,nervious,y'all srsly 'm fucking nervious 'm still shaking
46,nervious,wow Nancy Trumps wants drag impeachment hearings Senate Is making nervious
47,nervious,`` Rebbeca feeling nervious '' Rebbeca I know family happened FIRST family
48,nervious,`` Rebbeca feeling nervious '' Rebbeca I know family happened FIRST family
49,nervious,Aim nervious
